Title,Link,Image,Author,Date,Description,Fake News
Data: ?India Ageing Report 2023? Highlights Challenges of Demographic Shift,https://factly.in/data-india-ageing-report-2023-highlights-challenges-of-demographic-shift/,https://factly.in/wp-content/uploads//2020/09/NSS-report_Featured-Image-702x336.jpg,Pavithra K M,13-Oct-23,"To understand the phenomenon of ageing in India, the UNFPA India, in collaboration IIPS recently?",FALSE
Data: Tracking the Trend on Household Savings,https://factly.in/data-tracking-the-trend-on-household-savings/,https://factly.in/wp-content/uploads//2021/03/Central-Government-Debt_Image-702x336.jpg,Sai Krishna Muthyanolla,12-Oct-23,Household savings are an important measure that indicate multiple different things about the economy. The?,FALSE
Review: Karnataka HC Rules That Attesting Witness to Sale Deed Can?t be Held Criminally Liable for Cheating in Absence of any Allegations,https://factly.in/review-karnataka-hc-rules-that-attesting-witness-to-sale-deed-cant-be-held-criminally-liable-for-cheating-in-absence-of-any-allegations/,https://factly.in/wp-content/uploads//2023/03/Court-Judgements_-Image-702x336.jpg,Bharath Kancharla,11-Oct-23,"In this week?s review of Court Judgments, we look at Supreme Court?s observation that Insurance?",TRUE
Data: Only About Half the Males in Rural Areas are Now Employed in Primary Sector Compared to More Than 75% Twenty-Five Years Ago,https://factly.in/data-only-about-half-the-males-in-rural-areas-are-now-employed-in-primary-sector-compared-to-more-than-75-twenty-five-years-ago/,https://factly.in/wp-content/uploads//2020/06/Agriculture-Ordinances_Featured-Image-702x336.jpg,Pavithra K M,10-Oct-23,RBI?s Handbook of Statistics on Indian Economy provided compiled data on employment situation from various?,TRUE
"(09 October 2023) Government Data Roundup: Reports by UNFPA, Law Commission, RBI Among Those Released Recently",https://factly.in/09-october-2023-government-data-roundup-reports-by-unfpa-law-commission-rbi-among-those-released-recently/,https://factly.in/wp-content/uploads//2021/08/Share-of-Elderly-population_image-702x336.jpg,Sai Krishna Muthyanolla,09-Oct-23,"In this 39th edition of fortnightly government data roundup, we look at the India Ageing?",FALSE
Data: More than 50% of the Cybercrimes Reported Between 2002 & 2021 have ?Fraud? as the Motive,https://factly.in/data-more-than-50-of-the-cybercrimes-reported-between-2002-2021-have-fraud-as-the-motive/,https://factly.in/wp-content/uploads//2022/03/Online-financial-fraud_Image-702x336.jpg,Bharath Kancharla,06-Oct-23,Data from the NCRB indicates that around 1.28 lakhs cybercrimes reported during 2002-2021 have ?fraud??,FALSE
"Data: More Than Rs. 10,800 Crores Paid by DICGC Towards Claims by Banks as of March 2022",https://factly.in/data-more-than-rs-10800-crores-paid-by-dicgc-towards-claims-by-banks-as-of-march-2022/,https://factly.in/wp-content/uploads//2020/03/insurance-cover-on-bank-deposits_featured-image-702x336.jpg,Pavithra K M,05-Oct-23,The Deposit Insurance and Credit Guarantee Corporation (DICGC) is a subsidiary of the Reserve Bank?,FALSE
Review: Kerala HC Rules That Nature of Previous Divorce is Irrelevant at The Time of Marriage Registration Under SMA,https://factly.in/review-kerala-hc-rules-that-nature-of-previous-divorce-is-irrelevant-at-the-time-of-marriage-registration-under-sma/,https://factly.in/wp-content/uploads//2022/07/Review-of-Court-Judgments_Featured-Image-1-702x336.jpg,Sai Krishna Muthyanolla,04-Oct-23,"In this edition of court judgements, we look at the Supreme Court?s judgements on medical?",TRUE
"Data: In 20 Years Between 2002 & 2021, Five States Accounted for More Than 2/3rd of the Cybercrimes Reported in India",https://factly.in/data-in-20-years-between-2002-2021-five-states-accounted-for-more-than-2-3rd-of-the-cybercrimes-reported-in-india/,https://factly.in/wp-content/uploads//2021/09/registered-Cyber-crimes_image-702x336.jpg,Bharath Kancharla,02-Oct-23,"As information technology increases to become a more integral part of our lives, crimes associated?",FALSE
"Data: Like the Lok Sabha, Women?s Representation in State Assemblies Remains Poor",https://factly.in/data-like-the-lok-sabha-womens-representation-in-state-assemblies-remains-poor/,https://factly.in/wp-content/uploads//2023/09/Women-MLAs-in-state-assemblies-featured-image-702x336.jpeg,Pavithra K M,29-Sep-23,"Data indicates that like in the case of Lok Sabha, the representation of women in?",TRUE
"Data: Compared to 2019-20, Market Borrowings of the Central Government More than Doubled",https://factly.in/data-compared-to-2019-20-market-borrowings-of-the-central-government-more-than-doubled/,https://factly.in/wp-content/uploads//2021/03/Central-Government-Debt_Image-702x336.jpg,Sai Krishna Muthyanolla,28-Sep-23,The RBI?s annual ?Handbook of Statistics on the Indian Economy? offers an extensive collection of?,TRUE
Review: Kerala HC Rules That Legal Presumption/Assessment of Death Must for Issue of Legal Heirship Certificate to Kin of Missing,https://factly.in/review-kerala-hc-rules-that-legal-presumption-assessment-of-death-must-for-issue-of-legal-heirship-certificate-to-kin-of-missing/,https://factly.in/wp-content/uploads//2022/07/Review-of-Court-Judgments_Featured-Image-1-702x336.jpg,Bharath Kancharla,27-Sep-23,"In this week?s review of Court Judgments, we look at Supreme Court?s observation highlighting the?",TRUE
Data: How Did Share of Women MPs & Contestants Change in Lok Sabha Over the Years?,https://factly.in/data-how-did-share-of-women-mps-contestants-change-in-lok-sabha-over-the-years/,https://factly.in/wp-content/uploads//2017/09/Parliamentary-committee-on-Women%E2%80%99s-Reservation_factly-1-702x336.jpg,Pavithra K M,26-Sep-23,"With the passage of Women?s Reservation Bill, to be implemented post new Census Data &?",FALSE
"(25 September 2023) Government Data Roundup: Reports by RBI, MoSPI, TRAI Among Those Released Recently",https://factly.in/25-september-2023-government-data-roundup-reports-by-rbi-mospi-trai-among-those-released-recently/,https://factly.in/wp-content/uploads//2022/06/Government-Data-Roundup_Image-702x336.jpg,Sai Krishna Muthyanolla,25-Sep-23,"In this 38th edition of fortnightly government data roundup, we look we look at the?",FALSE
Data: Analysing India?s Performance at the Asian Games,https://factly.in/data-analysing-indias-performance-at-the-asian-games/,https://factly.in/wp-content/uploads//2023/09/Asian-games-india-featured-image-702x336.jpeg,Bharath Kancharla,22-Sep-23,"India won 70 medals at the 2018 Asian Games, the highest ever. But India?s position?",FALSE
"Review: NCAER Study Finds That While Incomes Increased by Only 4%, Expenditure of Food Delivery Workers Increased by Over 20% in the Last Four Years",https://factly.in/review-ncaer-study-finds-that-while-incomes-increased-by-only-4-expenditure-of-food-delivery-workers-increased-by-over-20-in-the-last-four-years/,https://factly.in/wp-content/uploads//2023/09/food-dlivery-worker-featured-image-702x336.jpeg,Pavithra K M,21-Sep-23,"Recently, the National Council of Applied Economic Research (NCAER) released a report on ?the Socio-economic?",TRUE
Review: Madras HC Rules That Love and Affection is a Deemed Condition for Transfer of Property by Senior Citizens and its Violation Leads to Cancellation of Such Transfer,https://factly.in/review-madras-hc-rules-that-love-and-affection-is-a-deemed-condition-for-transfer-of-property-by-senior-citizens-and-its-violation-leads-to-cancellation-of-such-transfer/,https://factly.in/wp-content/uploads//2022/11/Review-of-Court-Judgments_Featured-Image-2-702x336.jpg,Sai Krishna Muthyanolla,20-Sep-23,"In this edition of Court Judgements, we look at the Supreme Court?s judgements on immunity?",FALSE
"Data: Since 1993, Only 57% of Ministries Selected for ?Demand for Grants? Discussion were Actually Discussed",https://factly.in/data-since-1993-only-57-of-ministries-selected-for-demand-for-grants-discussion-were-actually-discussed/,https://factly.in/wp-content/uploads//2022/01/17th-Lok-Sabha_-Image-702x336.jpg,Bharath Kancharla,18-Sep-23,"During the budget session of the Lok Sabha every year, the ?Demand for Grants? of?",TRUE
"Data: More than 11,000 Athletes Competed in the 2018 Asian Games, the Highest till Date",https://factly.in/data-more-than-11000-athletes-competed-in-the-2018-asian-games-the-highest-till-date/,https://factly.in/wp-content/uploads//2023/09/2022-asian-games-mascot-702x336.jpeg,Pavithra K M,15-Sep-23,"The 19th edition of the Asian Games will begin soon on Hangzhou, China. Asian Games,?",FALSE
"NFHS-5 Data: Assam, MP, Rajasthan, and UP Account for Half the Districts with Share of Anaemic Pregnant Women Above National Average",https://factly.in/nfhs-5-data-assam-mp-rajasthan-and-up-account-for-half-the-districts-with-share-of-anaemic-pregnant-women-above-national-average/,https://factly.in/wp-content/uploads//2023/09/anaemic-in-pregnant-women-featured-702x336.jpeg,Sai Krishna Muthyanolla,14-Sep-23,"Data from the NFHS indicates that while there has been improvement in nutrition related indicators,?",FALSE
Review: Delhi HC Rules That Father?s Second Marriage After First Wife?s Death Doesn?t Disqualify Him from Being Child?s Natural Guardian,https://factly.in/review-delhi-hc-rules-that-fathers-second-marriage-after-first-wifes-death-doesnt-disqualify-him-from-being-childs-natural-guardian/,https://factly.in/wp-content/uploads//2022/11/court-judgements-_Featured-Image-702x336.jpg,Bharath Kancharla,13-Sep-23,"In this week?s review of Court Judgments, we look at Supreme Court?s judgment regarding the?",TRUE
"Explainer: As People Rush to Buy Real Estate on The Moon, Here is What the Outer Space Treaties Say",https://factly.in/explainer-as-people-rush-to-buy-real-estate-on-the-moon-here-is-what-the-outer-space-treaties-say/,https://factly.in/wp-content/uploads//2023/09/moon-real-estate-featured-image-702x336.jpeg,Pavithra K M,12-Sep-23,"Following the successful soft-landing of Chandrayaan-3 on the Moon, there have been numerous reports of?",FALSE
"(11 September 2023) Government Data Roundup: Reports by Ministry of Jal Shakti, Finance, RBI, MoSPI Among Those Released Recently",https://factly.in/11-september-2023-government-data-roundup-reports-by-ministry-of-jal-shakti-finance-rbi-mospi-among-those-released-recently/,https://factly.in/wp-content/uploads//2021/01/RERA-act_Image-702x336.jpg,Sai Krishna Muthyanolla,11-Sep-23,"In this 37th edition of fortnightly government data roundup, we look at the 6th Census?",FALSE
Data: Ground Water Schemes Make Up Nearly 95% of the Minor Irrigation Schemes in India,https://factly.in/data-ground-water-schemes-make-up-nearly-95-of-the-minor-irrigation-schemes-in-india/,https://factly.in/wp-content/uploads//2023/09/Minor-irrigation-featured-image-702x336.jpeg,Bharath Kancharla,08-Sep-23,Minor Irrigation Schemes (MIS) include both groundwater schemes as well as surface water schemes. As?,FALSE
"Data: While NFHS-5 Indicates Progress on Nutrition Related Indicators, Some Districts are Far Behind the Curve",https://factly.in/data-while-nfhs-5-indicates-progress-on-nutrition-related-indicators-some-districts-are-far-behind-the-curve/,https://factly.in/wp-content/uploads//2021/12/increase-in-Anaemia_Featured-Image-702x336.jpg,Pavithra K M,07-Sep-23,The National Family Health Survey (NFHS) reports provide data on nutrition-related indicators. As per NFHS-5?,FALSE
Review: Supreme Court Rules That Conviction for Attempted Murder Can be Upheld Even if The Injuries Inflicted on Victim Were Minor/Simple in Nature.,https://factly.in/review-supreme-court-rules-that-conviction-for-attempted-murder-can-be-upheld-even-if-the-injuries-inflicted-on-victim-were-minor-simple-in-nature/,https://factly.in/wp-content/uploads//2022/06/Review-of-Court-Judgments_Image-702x336.jpg,Sai Krishna Muthyanolla,06-Sep-23,"In this edition of Court Judgements, we look at the Supreme Court?s judgements on conviction?",FALSE
Review: State of India?s Birds 2023 Report Highlights Species Requiring Immediate Attention for Conservation,https://factly.in/review-state-of-indias-birds-2023-report-highlights-species-requiring-immediate-attention-for-conservation/,https://factly.in/wp-content/uploads//2023/09/state-of-birds-featured-image-702x336.png,Pavithra K M,04-Sep-23,The State of India?s Birds 2023 report is a periodic assessment that examines the geographic?,FALSE
Data: NFHS-5 Results Indicate a Slight Reduction in Average OOPE Per Delivery in a Public Health Facility,https://factly.in/data-nfhs-5-results-indicate-a-slight-reduction-in-average-oope-per-delivery-in-a-public-health-facility/,https://factly.in/wp-content/uploads//2023/09/NHS-Survey-702x336.jpg,Sai Krishna Muthyanolla,01-Sep-23,Data from the National Family Health Surveys (NFHS) indicates that the Out-of-pocket expenditure (OOPE) per?,TRUE
"Data: ISRO?s Missions, Launches & Journey in Numbers",https://factly.in/data-isros-missions-launches-journey-in-numbers/,https://factly.in/wp-content/uploads//2023/08/ISRO-Missions_Image-702x336.jpg,Bharath Kancharla,31-Aug-23,"From using USSR?s rocket to launch India?s first satellite in 1975, ISRO has come a?",TRUE
"Review: Supreme Court Rules That When Employer?s Question is Vague, Appointment Can?t be Denied Stating Suppression of Facts",https://factly.in/review-supreme-court-rules-that-when-employers-question-is-vague-appointment-cant-be-denied-stating-suppression-of-facts/,https://factly.in/wp-content/uploads//2022/06/Review-of-Court-Judgments_Image-702x336.jpg,Pavithra K M,30-Aug-23,"In this week?s review of Court Judgments, we look at the Supreme Court?s judgment that?",FALSE
Data: Quantity of Drugs Seized Increased in Last Few Years,https://factly.in/data-quantity-of-drugs-seized-increased-in-last-few-years/,https://factly.in/wp-content/uploads//2022/02/Seized-illicit-Drugs_Image-702x336.jpg,Sai Krishna Muthyanolla,29-Aug-23,"The Standing Committee on Social Justice and Empowerment recently submitted a report titled, ?Drug Abuse?",FALSE
Data: FCI?s Central Pool Stocks of Rice & Wheat Though Above The Minimum Levels Are Lower Than Previous Years,https://factly.in/data-fcis-central-pool-stocks-of-rice-wheat-though-above-the-minimum-levels-are-lower-than-previous-years/,https://factly.in/wp-content/uploads//2022/09/Food-grain-stocks_Featured-Image-702x336.jpg,Pavithra K M,25-Aug-23,The Food Corporation of India (FCI) is mandated to hold certain volume of procured food?,FALSE
Data: CSR Expenditure on Healthcare More Than Doubled in the Last Four Years,https://factly.in/data-csr-expenditure-on-healthcare-more-than-doubled-in-the-last-four-years/,https://factly.in/wp-content/uploads//2017/06/CSR-expenditure-in-2015-16_factly-702x336.jpg,Sai Krishna Muthyanolla,24-Aug-23,Data as of August 2023 indicates that more than Rs. 1.5 lakh crores have been?,TRUE
Review: Kerala HC Rules That Legal Heirship Certificate Cannot be Issued in Absence of Valid Adoption and Supporting Evidence,https://factly.in/review-kerala-hc-rules-that-legal-heirship-certificate-cannot-be-issued-in-absence-of-valid-adoption-and-supporting-evidence/,https://factly.in/wp-content/uploads//2022/07/Review-of-Court-Judgments_Featured-Image-1-702x336.jpg,Bharath Kancharla,23-Aug-23,"In this week?s review of Court Judgments, we look at the Supreme Court?s judgment regarding?",TRUE
Review: CAG Highlights Certain Gaps in the implementation of the RCS-UDAN Scheme,https://factly.in/review-cag-highlights-certain-gaps-in-the-implementation-of-the-rcs-udan-scheme/,https://factly.in/wp-content/uploads//2023/06/Civil-Aviation_Image-702x336.jpg,Pavithra K M,22-Aug-23,Regional Connectivity Scheme ? UDAN (Ude Desh Ka Aam Naagrik) is a scheme initiated by?,TRUE
Data: Over 3 Lakh Hectares of Forest Land Diverted for Non-Forest Use in the Last 15 Years,https://factly.in/data-over-3-lakh-hectares-of-forest-land-diverted-for-non-forest-use-in-the-last-15-years/,https://factly.in/wp-content/uploads//2023/08/Featured-image-forest-land-diversion-702x336.jpeg,Sai Krishna Muthyanolla,21-Aug-23,Data provided by the government indicate that over 3 lakh hectares of forest land has?,FALSE
"Review: CAG Highlights Multiple Discrepancies in Ayushman Bharat ? Pradhan Mantri Jan Arogya Yojana, Makes Recommendations",https://factly.in/review-cag-highlights-multiple-discrepancies-in-ayushman-bharat-pradhan-mantri-jan-arogya-yojana-makes-recommendations/,https://factly.in/wp-content/uploads//2023/08/performance-audit-report_image-702x336.jpg,Bharath Kancharla,18-Aug-23,"Recently, the CAG tabled the performance audit report on the Ayushman Bharat-Pradhan Mantri Jan Arogya?",TRUE
"Review: SC Rules Sports Quota is to Encourage Sports and Sportsmanship in Educational Institutions, Not to Prioritize Academic Excellence",https://factly.in/review-sc-rules-sports-quota-is-to-encourage-sports-and-sportsmanship-in-educational-institutions-not-to-prioritize-academic-excellence/,https://factly.in/wp-content/uploads//2022/06/Review-of-Court-Judgments_Image-702x336.jpg,Pavithra K M,17-Aug-23,"In this week?s review of Court Judgments, we look at Supreme Court?s judgments that Sports?",TRUE
"Data: Reviewing India?s Progress on Drinking Water, Sanitation, Electricity, Access to Institutional Credit",https://factly.in/data-reviewing-indias-progress-on-drinking-water-sanitation-electricity-access-to-institutional-credit/,https://factly.in/wp-content/uploads//2023/08/drinking-water_image-702x336.jpg,Sai Krishna Muthyanolla,15-Aug-23,"As India celebrates the 77th Independence Day, it is important to look back at the?",FALSE
"(14 August 2023) Government Data Roundup: Reports by MoSPI, CAG, Parliamentary Standing Committees Among Those Released Recently",https://factly.in/14-august-2023-government-data-roundup-reports-by-mospi-cag-parliamentary-standing-committees-among-those-released-recently/,https://factly.in/wp-content/uploads//2023/08/Government-Data_Image-1-702x336.jpg,Bharath Kancharla,14-Aug-23,"In this 35th edition of the fortnightly roundup of government data, we look at some?",FALSE
"Parliament Review: No-Confidence Motion Taken Up for Discussion, Important Bills Passed",https://factly.in/parliament-review-no-confidence-motion-taken-up-for-discussion-important-bills-passed/,https://factly.in/wp-content/uploads//2023/08/Parliament-Review_Image-3-702x336.jpg,Pavithra K M,11-Aug-23,"The Lok Sabha took up the No-Confidence motion for discussion. In the meanwhile, many important?",FALSE
"Data: Among CAPFs, Most Suicides in CRPF in the Last Five Years",https://factly.in/data-among-capfs-most-suicides-in-crpf-in-the-last-five-years/,https://factly.in/wp-content/uploads//2023/08/suicides-in-CRPF_Featured-Image-702x336.jpg,Sai Krishna Muthyanolla,10-Aug-23,Data from various parliament responses indicates that the number of suicides in the Central Armed?,FALSE
Review: Allahabad HC Rules That First Wife Can File Applications Under Hindu Marriage Act for Declaration of Husband?s Second Marriage as Void.,https://factly.in/review-allahabad-hc-rules-that-first-wife-can-file-applications-under-hindu-marriage-act-for-declaration-of-husbands-second-marriage-as-void/,https://factly.in/wp-content/uploads//2021/05/Importand-COurt-JUdgements_Featured-Image-702x336.jpg,Bharath Kancharla,09-Aug-23,"In this week?s review of Court Judgments, we look at the Allahabad High Court upholding?",TRUE
"Data: Huge Variation in Multidimensionally Poor Population Across India?s Districts, from 0% in Ernakulam to 55% in Bahraich",https://factly.in/data-huge-variation-in-multidimensionally-poor-population-across-indias-districts-from-0-in-ernakulam-to-55-in-bahraich/,https://factly.in/wp-content/uploads//2021/12/Multidimensional-Poverty-estimates_featured-image-702x336.jpg,Pavithra K M,08-Aug-23,The Multidimensional Poverty Index (MPI): A Progress Review 2023 based on NFHS 5th round (2019-21)?,FALSE
Data: Market Loans Now Make Up About 2/3rds of Outstanding Debt of States/UTs,https://factly.in/data-market-loans-now-make-up-about-2-3rds-of-outstanding-debt-of-states-uts/,https://factly.in/wp-content/uploads//2021/03/Central-Government-Debt_Image-702x336.jpg,Sai Krishna Muthyanolla,07-Aug-23,Data on the outstanding debt of States/UTs indicates that the total outstanding liabilities of States/UTs?,TRUE
"Parliament Review: As Disruptions Continue, Government Passes Important Bills. No-Confidence Motion Listed for Discussion Next Week",https://factly.in/parliament-review-as-disruptions-continue-government-passes-important-bills-no-confidence-motion-listed-for-discussion-next-week/,https://factly.in/wp-content/uploads//2023/08/Parliament-Review_Image-1-702x336.jpg,Bharath Kancharla,04-Aug-23,Both houses of parliament continued to witness disruptions even during the second week of the?,FALSE
Review: Supreme Court Rules that Doctor?s License Cannot be Suspended as Penalty Under Contempt of Courts Act 1971.,https://factly.in/review-supreme-court-rules-that-doctors-license-cannot-be-suspended-as-penalty-under-contempt-of-courts-act-1971/,https://factly.in/wp-content/uploads//2022/06/Review-of-Court-Judgments_Image-702x336.jpg,Sai Krishna Muthyanolla,02-Aug-23,"In this edition of the court judgements review, we look at the Supreme Court?s judgements?",FALSE
Data: Numbers of the No-Confidence & Confidence Motions,https://factly.in/data-numbers-of-the-no-confidence-confidence-motions/,https://factly.in/wp-content/uploads//2023/08/Screenshot-2023-07-31-at-6-702x336.jpg,Bharath Kancharla,01-Aug-23,"Data indicates that since 1952, there have been 27 No-Confidence motions and 12 Confidence motions,?",FALSE
"(31 July 2023) Government Data Roundup: Reports by NITI Aayog, MoSPI,  TRAI Among Those Released Recently",https://factly.in/31-july-2023-government-data-roundup-reports-by-niti-aayog-mospi-trai-among-those-released-recently/,https://factly.in/wp-content/uploads//2019/08/subsidy-for-Rooftop-Solar-plants_featured-image-702x336.jpg,Pavithra K M,31-Jul-23,The 34th edition of the Fortnightly Roundup of Government Data covers reports released by NITI?,FALSE
Parliament Review: No Significant Business in the First Week of Monsoon Session for 2023,https://factly.in/parliament-review-no-significant-business-in-the-first-week-of-monsoon-session-for-2023/,https://factly.in/wp-content/uploads//2023/07/Monsoon-Session_Image-702x336.jpg,Sai Krishna Muthyanolla,28-Jul-23,Both houses of parliament witnessed disruptions due to repeated adjournments during the first week of?,TRUE
Data: WhatsApp Banned More Than 6.9 Crore Accounts in The Last Two Years,https://factly.in/data-whatsapp-banned-more-than-6-9-crore-accounts-in-the-last-two-years/,https://factly.in/wp-content/uploads//2023/07/IT-Rules_Image-702x336.jpg,Bharath Kancharla,27-Jul-23,"The IT Rules of 2021, mandate big technology companies or the SSMIs to publish a?",FALSE
Review: SC Rules That Compliance with Section 52 of NDPS Act is Mandatory for Disposing Seized Narcotic Substances,https://factly.in/review-sc-rules-that-compliance-with-section-52-of-ndps-act-is-mandatory-for-disposing-seized-narcotic-substances/,https://factly.in/wp-content/uploads//2022/06/Review-of-Court-Judgments_Image-702x336.jpg,Pavithra K M,26-Jul-23,"In this edition of the court judgements review, we look at the Supreme Court?s judgement?",FALSE
Data: Andhra Pradesh & Telangana Register Highest Increase in Annual Ground Water Recharge in Last Decade,https://factly.in/data-andhra-pradesh-telangana-register-highest-increase-in-annual-ground-water-recharge-in-last-decade/,https://factly.in/wp-content/uploads//2022/12/Groundwater-Extraction_Featured-Image-702x336.jpg,Sai Krishna Muthyanolla,25-Jul-23,As per data provided in the 2022 National Compilation of Dynamic Ground Water Resources Assessment?,FALSE
Data: Less Than 10% Population Multidimensionally Poor in 14 States,https://factly.in/data-less-than-10-population-multidimensionally-poor-in-14-states/,https://factly.in/wp-content/uploads//2021/12/Multidimensional-Poverty-estimates_featured-image-702x336.jpg,Pavithra K M,24-Jul-23,NITI Aayog recently released the Multidimensional Poverty Index (MPI): A Progress Review 2023. This report looks?,TRUE
Data from Compliance Reports of Technology Platforms Show Varied Reasons for Grievances Filed,https://factly.in/data-from-compliance-reports-of-technology-platforms-show-varied-reasons-for-grievances-filed/,https://factly.in/wp-content/uploads//2023/07/social-media-featured-image-702x336.jpg,Bharath Kancharla,21-Jul-23,"The IT Rules of 2021, mandate big technology companies or the SSMIs to publish a?",FALSE
Data: No District in Top-2 Grades of Performance Grading Index in 2020-21 & 2021-22,https://factly.in/data-no-district-in-top-2-grades-of-performance-grading-index-in-2020-21-2021-22/,https://factly.in/wp-content/uploads//2022/07/Performance-Grading-Index_Image-702x336.jpg,Sai Krishna Muthyanolla,20-Jul-23,The Performance Grading Index (PGI) offers information on the state of school education in States?,FALSE
Review: SC Rules That Regularizing Employment of Only Some Employees is Discriminatory and Violative of Article 14,https://factly.in/review-sc-rules-that-regularizing-employment-of-only-some-employees-is-discriminatory-and-violative-of-article-14/,https://factly.in/wp-content/uploads//2022/06/Review-of-Court-Judgments_Image-702x336.jpg,Pavithra K M,19-Jul-23,"In this edition of court judgements review, we look at Supreme Court?s judgement about final?",TRUE
"(17 July 2023) Government Data Roundup: Reports By RBI, MoE, MoSPI, Among Those Released Recently",https://factly.in/17-july-2023-government-data-roundup-reports-by-rbi-moe-mospi-among-those-released-recently/,https://factly.in/wp-content/uploads//2023/07/Government-Data_Image-702x336.jpg,Sai Krishna Muthyanolla,17-Jul-23,The 33rd edition of the fortnightly roundup of government data covers the Performance Grading Index?,FALSE
