Title,Link,Image,Author,Date,Description,Fake News
Muslim cleric?s photo misused to show him encouraging Muslim women to lure Hindu men,https://www.altnews.in/muslim-clerics-photo-misused-to-show-him-encouraging-muslim-women-to-lure-hindu-men/,https://www.altnews.in/wp-content/uploads/2021/07/FI-1-2-300x157.jpg,Archit,19th July 2021,Muslim cleric?s photo misused to show him encouraging Muslim women to lure Hindu men,TRUE
Muslim cleric?s photo misused to show him encouraging Muslim women to lure Hindu men,https://www.altnews.in/muslim-clerics-photo-misused-to-show-him-encouraging-muslim-women-to-lure-hindu-men/,https://www.altnews.in/wp-content/uploads/2021/07/FI-1-2-300x157.jpg,Archit,19th July 2021,Muslim cleric?s photo misused to show him encouraging Muslim women to lure Hindu men,TRUE
Old photo from Bangladesh viral as crowd welcoming Asaduddin Owaisi in Ghaziabad,https://www.altnews.in/old-photo-from-bangladesh-viral-as-crowd-welcoming-asaduddin-owaisi-in-ghaziabad/,https://www.altnews.in/wp-content/uploads/2021/07/Untitled-design-2021-07-17T150430.947-300x157.jpg,Arjun Sidharth,17th July 2021,Old photo from Bangladesh viral as crowd welcoming Asaduddin Owaisi in Ghaziabad,FALSE
Old photos of bus submerged under Delhi?s Minto Bridge shared as recent,https://www.altnews.in/old-image-of-delhi-minto-bridge-underpass-waterlogged-shared-as-recent/,https://www.altnews.in/wp-content/uploads/2021/07/Untitled-design-2021-07-16T153139.935-300x157.jpg,Priyanka Jha,16th July 2021,Old photos of bus submerged under Delhi?s Minto Bridge shared as recent,FALSE
Video from Taiwan shared as Euro Cup victory celebration in Italy,https://www.altnews.in/video-from-taiwan-shared-as-euro-cup-victory-celebration-in-italy/,https://www.altnews.in/wp-content/uploads/2021/07/Untitled-design-2021-07-15T193320.139-300x157.jpg,Pooja Chaudhuri,15th July 2021,Video from Taiwan shared as Euro Cup victory celebration in Italy,FALSE
Video of UP cops consuming alcohol on car bonnet was shot before CM Yogi took office,https://www.altnews.in/fact-check-video-of-two-cops-drinking-liquor-on-duty-is-not-from-yogis-regime/,https://www.altnews.in/wp-content/uploads/2021/07/FAKE-1-4-300x157.jpg,Kinjal,14th July 2021,Video of UP cops consuming alcohol on car bonnet was shot before CM Yogi took office,FALSE
Old report from Rakhine State viral as Hindus killed by Rohingya Muslims in Kolkata,https://www.altnews.in/old-report-from-rakhine-state-viral-as-hindus-killed-by-rohinyas-in-kolkata/,https://www.altnews.in/wp-content/uploads/2021/07/Untitled-design27-300x157.jpg,Kalim Ahmed,14th July 2021,Old report from Rakhine State viral as Hindus killed by Rohingya Muslims in Kolkata,TRUE
This sculpture is in Karnataka not Naga Vasuki Temple in UP?s Prayagraj,https://www.altnews.in/this-sculpture-is-in-karnataka-not-naga-vasuki-temple-in-ups-prayagraj/,https://www.altnews.in/wp-content/uploads/2021/07/Still-from-the-video-300x157.jpg,Kalim Ahmed,13th July 2021,This sculpture is in Karnataka not Naga Vasuki Temple in UP?s Prayagraj,FALSE
Video game showing MiG aircraft landing believed to be real,https://www.altnews.in/video-game-showing-mig-aircraft-landing-believed-to-be-real/,https://www.altnews.in/wp-content/uploads/2021/07/Untitled-design23-300x157.jpg,Kalim Ahmed,12th July 2021,Video game showing MiG aircraft landing believed to be real,FALSE
Video game showing MiG aircraft landing believed to be real,https://www.altnews.in/video-game-showing-mig-aircraft-landing-believed-to-be-real/,https://www.altnews.in/wp-content/uploads/2021/07/Untitled-design23-300x157.jpg,Kalim Ahmed,12th July 2021,Video game showing MiG aircraft landing believed to be real,FALSE
Photo of El Salvador women?s basketball team with US team shared as India,https://www.altnews.in/fact-check-viral-image-doesnt-show-height-difference-between-usa-and-india-under-16-basketball-team/,https://www.altnews.in/wp-content/uploads/2021/07/FAKE-1-3-300x157.jpeg,Kinjal,10th July 2021,Photo of El Salvador women?s basketball team with US team shared as India,TRUE
Video from 2013 shared as late actor Dilip Kumar?s last moments,https://www.altnews.in/2013-video-of-dilip-kumar-in-hospital-with-his-wife-saira-bano-shared-as-his-last-moment/,https://www.altnews.in/wp-content/uploads/2021/07/FAKE-3-300x157.jpeg,Kinjal,9th July 2021,Video from 2013 shared as late actor Dilip Kumar?s last moments,TRUE
Old photo of maulvi arrested in connection with IMA scam viral with false claim,https://www.altnews.in/unrelated-image-of-a-muslim-clerk-accused-in-ima-jewels-scam-viral-with-false-claim/,https://www.altnews.in/wp-content/uploads/2021/07/FAKE-2-300x157.jpeg,Kinjal,8th July 2021,Old photo of maulvi arrested in connection with IMA scam viral with false claim,TRUE
Old video falsely viral as angry mob ransacks petrol pump over rising petrol price,https://www.altnews.in/old-video-falsely-viral-as-angry-mob-ransacks-petrol-pump-over-rising-petrol-price/,https://www.altnews.in/wp-content/uploads/2021/07/Untitled-design19-300x157.jpg,Kalim Ahmed,6th July 2021,Old video falsely viral as angry mob ransacks petrol pump over rising petrol price,FALSE
"No, this is not ?newly renovated? Kashi Vishwanath Temple in Varanasi",https://www.altnews.in/viral-video-falsely-claim-that-is-shows-kashi-vishwanath-temple-varanasi-which-is-newly-renovated/,https://www.altnews.in/wp-content/uploads/2021/07/kashi-vishwanath-temple-FI-300x157.jpeg,Kinjal,5th July 2021,"No, this is not ?newly renovated? Kashi Vishwanath Temple in Varanasi",TRUE
"No, this is not ?newly renovated? Kashi Vishwanath Temple in Varanasi",https://www.altnews.in/viral-video-falsely-claim-that-is-shows-kashi-vishwanath-temple-varanasi-which-is-newly-renovated/,https://www.altnews.in/wp-content/uploads/2021/07/kashi-vishwanath-temple-FI-300x157.jpeg,Kinjal,5th July 2021,"No, this is not ?newly renovated? Kashi Vishwanath Temple in Varanasi",TRUE
Morphed ABP News graphic shows Rahul Gandhi wants India to be Islamic nation,https://www.altnews.in/morphed-abp-news-graphic-shows-rahul-gandhi-wants-india-to-be-islamic-nation/,https://www.altnews.in/wp-content/uploads/2021/07/FAKE4-300x157.jpg,Kalim Ahmed,2nd July 2021,Morphed ABP News graphic shows Rahul Gandhi wants India to be Islamic nation,FALSE
"BJP?s Priti Gandhi shares photo from Philippines as Mithi River, Mumbai",https://www.altnews.in/bjps-priti-gandhi-shares-photo-from-philippines-as-mithi-river-mumbai/,https://www.altnews.in/wp-content/uploads/2021/06/Untitled-design16-300x157.jpg,Kalim Ahmed,28th June 2021,"BJP?s Priti Gandhi shares photo from Philippines as Mithi River, Mumbai",TRUE
Video of man contaminating milk is from Pakistan,https://www.altnews.in/video-of-man-contaminating-milk-is-from-pakistan/,https://www.altnews.in/wp-content/uploads/2021/06/Untitled-design-2-300x157.jpg,Aqib Pathan,25th June 2021,Video of man contaminating milk is from Pakistan,TRUE
False news that Dr Fauci has been sacked as chief medical adviser to US President viral,https://www.altnews.in/false-news-that-dr-fauci-has-been-sacked-as-chief-medical-adviser-to-us-president-viral/,https://www.altnews.in/wp-content/uploads/2021/06/FI-7-300x157.jpg,Archit,24th June 2021,False news that Dr Fauci has been sacked as chief medical adviser to US President viral,FALSE
Old photo of water dispenser installed at Raipur station viral as Delhi,https://www.altnews.in/2018-image-of-hussain-water-cooler-at-raipur-station-shared-as-delhi/,https://www.altnews.in/wp-content/uploads/2021/06/Facebook-Ad-1200x628-px-8-300x157.jpeg,Kinjal,23rd June 2021,Old photo of water dispenser installed at Raipur station viral as Delhi,FALSE
Tweet by parody account in the name of ex-CJI Ranjan Gogoi believed to be true,https://www.altnews.in/fake-tweet-of-cji-ranjan-gogoi-about-hindu-muslim-bauddh-christian-festival-indian-constitution-amendment-is-viral/,https://www.altnews.in/wp-content/uploads/2021/06/FAKE-3-300x157.jpeg,Kinjal,21st June 2021,Tweet by parody account in the name of ex-CJI Ranjan Gogoi believed to be true,FALSE
Satirical article claiming mosquitos injected with Viagra escape from Wuhan lab viral,https://www.altnews.in/satirical-article-claiming-mosquitos-injected-with-viagra-escape-from-wuhan-lab-viral/,https://www.altnews.in/wp-content/uploads/2021/06/FI-6-300x157.jpg,Archit,16th June 2021,Satirical article claiming mosquitos injected with Viagra escape from Wuhan lab viral,FALSE
Old video of man vandalising statue in Algeria shared as Italy,https://www.altnews.in/old-video-of-man-vandalising-statue-in-algeria-shared-as-italy/,https://www.altnews.in/wp-content/uploads/2021/06/Untitled-design9-300x157.jpg,Kalim Ahmed,14th June 2021,Old video of man vandalising statue in Algeria shared as Italy,FALSE
"Tractor driver runs over cow, social media falsely alludes accused is Muslim",https://www.altnews.in/tractor-driver-runs-over-cow-social-media-falsely-alludes-accused-is-muslim/,https://www.altnews.in/wp-content/uploads/2021/06/Untitled-design-2021-06-09T160214.379-300x157.jpg,Pooja Chaudhuri,9th June 2021,"Tractor driver runs over cow, social media falsely alludes accused is Muslim",FALSE
Video of Ashok Gehlot visiting dargah in 2019 shared as the CM offering ?Friday prayers?,https://www.altnews.in/old-video-of-cm-ashok-gehlot-coming-out-of-dargah-shared-as-recent-with-false-claims/,https://www.altnews.in/wp-content/uploads/2021/06/gehlot-fi-300x157.jpeg,Anuradha Prasad,7th June 2021,Video of Ashok Gehlot visiting dargah in 2019 shared as the CM offering ?Friday prayers?,TRUE
Fact-check: Are circuit boards with ?COV 19? engraving being installed on 5G towers?,https://www.altnews.in/fact-check-are-circuit-boards-with-cov-19-engraving-being-installed-on-5g-towers/,https://www.altnews.in/wp-content/uploads/2021/06/COV-19-300x157.jpeg,Jignesh Patel,3rd June 2021,Fact-check: Are circuit boards with ?COV 19? engraving being installed on 5G towers?,TRUE
Old video from Gujarat falsely shared as Muslim mob beats cops in Telangana,https://www.altnews.in/old-video-from-gujarat-falsely-shared-as-muslim-mob-beats-cops-in-telangana/,https://www.altnews.in/wp-content/uploads/2021/05/Untitled-design-300x157.jpg,Pooja Chaudhuri,29th May 2021,Old video from Gujarat falsely shared as Muslim mob beats cops in Telangana,FALSE
Video of Congress leader lashing out at PM Modi over COVID viral as Maneka Gandhi,https://www.altnews.in/video-of-congress-leader-lashing-out-at-pm-modi-over-covid-viral-as-maneka-gandhi/,https://www.altnews.in/wp-content/uploads/2021/05/Untitled-design-2021-05-25T222505.425-300x157.jpg,Alt News Desk,25th May 2021,Video of Congress leader lashing out at PM Modi over COVID viral as Maneka Gandhi,TRUE
Video from UP falsely shared as 31 Rohingya ?elected? in West Bengal chanted ?Pakistan Zindabad?,https://www.altnews.in/video-of-people-in-up-bahraich-shouting-haji-saab-zindabad-shared-as-pro-pakistan-sloganeering-in-west-bengal/,https://www.altnews.in/wp-content/uploads/2021/05/bahraich-fi-300x157.jpg,Anuradha Prasad,25th May 2021,Video from UP falsely shared as 31 Rohingya ?elected? in West Bengal chanted ?Pakistan Zindabad?,FALSE
"Video of Sonia Gandhi, Manmohan Singh?s meeting with Sri Lankan PM is from 2017",https://www.altnews.in/video-of-sonia-gandhi-manmohan-singhs-meeting-with-sri-lankan-pm-is-from-2017/,https://www.altnews.in/wp-content/uploads/2021/05/FI-6-300x157.jpg,Archit,22nd May 2021,"Video of Sonia Gandhi, Manmohan Singh?s meeting with Sri Lankan PM is from 2017",TRUE
Video from South Africa shared as pride of lions spotted at Gir after Cyclone Taukte,https://www.altnews.in/video-from-south-africa-shared-as-pride-of-lions-spotted-at-gir-after-cyclone-taukte/,https://www.altnews.in/wp-content/uploads/2021/05/FI-2-2-300x157.jpg,Archit,21st May 2021,Video from South Africa shared as pride of lions spotted at Gir after Cyclone Taukte,TRUE
"No, an elderly man in Meerut did not stop Yogi Adityanath from entering his lane",https://www.altnews.in/fact-check-did-a-old-man-in-up-stopped-cm-yogi-adityanath-to-come-to-meet-him/,https://www.altnews.in/wp-content/uploads/2021/05/Cm-yogi--300x157.jpg,Priyanka Jha,20th May 2021,"No, an elderly man in Meerut did not stop Yogi Adityanath from entering his lane",FALSE
Old image from Agra shared as Budaun cop carrying dead body on shoulders,https://www.altnews.in/old-image-of-policemen-carrying-dead-body-on-his-shoulder-shared-as-recent/,https://www.altnews.in/wp-content/uploads/2021/05/FAKE-1-4-300x157.jpg,Kinjal,19th May 2021,Old image from Agra shared as Budaun cop carrying dead body on shoulders,TRUE
Old video from Saudi Arabia shared as Cyclone Tauktae?s devastation in Mumbai,https://www.altnews.in/video-from-saudi-arabia-shared-as-mumbai-cyclone-tauktae/,https://www.altnews.in/wp-content/uploads/2021/05/FI-1-2-300x157.jpg,Archit,19th May 2021,Old video from Saudi Arabia shared as Cyclone Tauktae?s devastation in Mumbai,FALSE
Fact-check: Was Rs 7k crore seized from Kerala?s Believers Church in IT raids last year?,https://www.altnews.in/fact-check-did-7000-cr-rs-seized-from-it-raids-in-a-church-from-kerala/,https://www.altnews.in/wp-content/uploads/2021/05/FAKE-2-2-300x157.jpeg,Kinjal,15th May 2021,Fact-check: Was Rs 7k crore seized from Kerala?s Believers Church in IT raids last year?,TRUE
Video from 2018 falsely shared as ?5G tower? caught fire in Gujarat,https://www.altnews.in/video-from-2018-falsely-shared-as-5g-tower-caught-fire-in-gujarat/,https://www.altnews.in/wp-content/uploads/2021/05/FI-3-FIRE-300x157.jpg,Archit,13th May 2021,Video from 2018 falsely shared as ?5G tower? caught fire in Gujarat,TRUE
"PMJJBY offers coverage against COVID-19 deaths, not PMSBY",https://www.altnews.in/pmjjby-offers-coverage-against-covid-19-deaths-not-pmsby/,https://www.altnews.in/wp-content/uploads/2021/05/FI-3-300x157.jpg,Archit,7th May 2021,"PMJJBY offers coverage against COVID-19 deaths, not PMSBY",FALSE
Fact-check: BJP workers are not fighting over oxygen distribution in this video,https://www.altnews.in/bjp-workers-are-vandalising-party-office-for-tickets-and-not-oxygen-cylinder/,https://www.altnews.in/wp-content/uploads/2021/05/sagarika-fi-300x157.jpg,Anuradha Prasad,5th May 2021,Fact-check: BJP workers are not fighting over oxygen distribution in this video,TRUE
Emotional video of journo Navin Kumar shared as last words of Rohit Sardana,https://www.altnews.in/emotional-video-of-journo-navin-kumar-shared-as-last-words-of-rohit-sardana/,https://www.altnews.in/wp-content/uploads/2021/05/FAKE-1-300x157.jpg,Kinjal,3rd May 2021,Emotional video of journo Navin Kumar shared as last words of Rohit Sardana,TRUE
False claim of Yati Narsinghanand?s arrest shared online,https://www.altnews.in/false-claim-of-narsimhanand-saraswati-arrested-viral-with-old-video/,https://www.altnews.in/wp-content/uploads/2021/05/word-image-24-300x157.jpeg,Abhishek Kumar,1st May 2021,False claim of Yati Narsinghanand?s arrest shared online,TRUE
Video of people fainting after Vizag gas leak last year falsely linked to COVID second wave,https://www.altnews.in/no-this-video-does-not-show-covid-patients-it-is-related-to-visakhapatnam-gas-leak-last-year/,https://www.altnews.in/wp-content/uploads/2021/04/fi-cr-300x157.jpeg,Anuradha Prasad,29th April 2021,Video of people fainting after Vizag gas leak last year falsely linked to COVID second wave,FALSE
Fact-check: Death certificates issued with PM Modi?s photo?,https://www.altnews.in/no-this-image-of-a-document-with-photo-of-pm-modi-in-not-a-death-certificate/,https://www.altnews.in/wp-content/uploads/2021/04/certificate-fi-300x157.jpg,Anuradha Prasad,25th April 2021,Fact-check: Death certificates issued with PM Modi?s photo?,FALSE
Fake letter claims Ajit Doval lauded Uttarakhand chief secy. for Kumbh Mela,https://www.altnews.in/fake-letter-claims-ajit-doval-lauded-uttarakhand-chief-secy-for-kumbh-mela/,https://www.altnews.in/wp-content/uploads/2021/04/Untitled-design-41-300x157.jpg,Pooja Chaudhuri,21st April 2021,Fake letter claims Ajit Doval lauded Uttarakhand chief secy. for Kumbh Mela,TRUE
Video of large funeral procession at UP madrasa shared as Iftar gathering in Hyderabad,https://www.altnews.in/video-of-large-funeral-procession-at-up-madrasa-shared-as-iftar-gathering-in-hyderabad/,https://www.altnews.in/wp-content/uploads/2021/04/Untitled-design-40-300x157.jpg,Pooja Chaudhuri,21st April 2021,Video of large funeral procession at UP madrasa shared as Iftar gathering in Hyderabad,FALSE
Photo of 2002 Gujarat riots convict shared with false NRC spin,https://www.altnews.in/photo-of-2002-gujarat-riots-convict-shared-with-false-nrc-spin/,https://www.altnews.in/wp-content/uploads/2021/04/Untitled-design-38-300x157.jpg,Pooja Chaudhuri,20th April 2021,Photo of 2002 Gujarat riots convict shared with false NRC spin,TRUE
Rumour of journalist Pragya Mishra?s murder is false,https://www.altnews.in/false-claim-of-journalist-pragya-mishra-murder-in-broad-day-light-shared-with-videos/,https://www.altnews.in/wp-content/uploads/2021/04/pragya-mishra--300x157.jpg,Anuradha Prasad,19th April 2021,Rumour of journalist Pragya Mishra?s murder is false,FALSE
"Photos from Egypt, Indonesia shared with #BanRamzanGatherings in India",https://www.altnews.in/photos-from-egypt-indonesia-shared-with-banramzangatherings-in-india/,https://www.altnews.in/wp-content/uploads/2021/04/Untitled-design-35-300x157.jpg,Pooja Chaudhuri,17th April 2021,"Photos from Egypt, Indonesia shared with #BanRamzanGatherings in India",TRUE
Unrelated video shared as recent protest in Pakistan by Islamist party TLP,https://www.altnews.in/unrelated-video-shared-as-recent-protest-in-pakistan-by-islamist-party-tlp/,https://www.altnews.in/wp-content/uploads/2021/04/Untitled-design-34-300x157.jpg,Archit,16th April 2021,Unrelated video shared as recent protest in Pakistan by Islamist party TLP,FALSE
Old images from Telangana falsely shared as cash seized from BJP Bengal leader?s residence,https://www.altnews.in/old-images-from-telangana-falsely-shared-as-cash-seized-from-bjp-bengal-leaders-residence/,https://www.altnews.in/wp-content/uploads/2021/04/Untitled-design-32-300x157.jpg,Archit,15th April 2021,Old images from Telangana falsely shared as cash seized from BJP Bengal leader?s residence,TRUE
Congress MLA JS Negi?s speech viral as Nepalese leader criticises PM Modi,https://www.altnews.in/congress-mla-js-negis-speech-viral-as-nepalese-leader-criticises-pm-modi/,https://www.altnews.in/wp-content/uploads/2021/04/negi-300x157.jpg,Archit,13th April 2021,Congress MLA JS Negi?s speech viral as Nepalese leader criticises PM Modi,TRUE
Congress MLA JS Negi?s speech viral as Nepalese leader criticises PM Modi,https://www.altnews.in/congress-mla-js-negis-speech-viral-as-nepalese-leader-criticises-pm-modi/,https://www.altnews.in/wp-content/uploads/2021/04/negi-300x157.jpg,Archit,13th April 2021,Congress MLA JS Negi?s speech viral as Nepalese leader criticises PM Modi,TRUE
Old video shared as vote rigging by TMC in West Bengal elections,https://www.altnews.in/old-video-shared-as-vote-rigging-in-ongoing-west-bengal-elections/,https://www.altnews.in/wp-content/uploads/2021/04/FI-3-300x157.jpg,Archit,10th April 2021,Old video shared as vote rigging by TMC in West Bengal elections,FALSE
Video from 2016 viral as BJP MLA Nand Kishor Gurjar beaten at Ghazipur border,https://www.altnews.in/video-from-2016-viral-as-bjp-mla-nand-kishor-gurjar-beaten-at-ghazipur-border/,https://www.altnews.in/wp-content/uploads/2021/04/Untitled-design-2021-04-08T133802.360-300x157.jpg,Kinjal,8th April 2021,Video from 2016 viral as BJP MLA Nand Kishor Gurjar beaten at Ghazipur border,FALSE
Image of 2013 Bangladesh riots shared as violence against Hindus in West Bengal,https://www.altnews.in/image-of-2013-bangladesh-riots-shared-as-violence-against-hindus-in-west-bengal/,https://www.altnews.in/wp-content/uploads/2021/04/Untitled-design-26-300x157.jpg,Pooja Chaudhuri,7th April 2021,Image of 2013 Bangladesh riots shared as violence against Hindus in West Bengal,FALSE
Old sexual assault video from Andhra revived with false communal spin,https://www.altnews.in/old-sexual-assault-video-from-andhra-revived-with-false-communal-spin/,https://www.altnews.in/wp-content/uploads/2021/04/Untitled-design-24-300x157.jpg,Priyanka Jha,6th April 2021,Old sexual assault video from Andhra revived with false communal spin,TRUE
Photo of Delhi CM Kejriwal giving mask to school boy predates COVID-19,https://www.altnews.in/photo-of-delhi-cm-kejriwal-giving-mask-to-school-boy-predates-covid-19/,https://www.altnews.in/wp-content/uploads/2021/04/FI-1-300x157.jpg,Archit,5th April 2021,Photo of Delhi CM Kejriwal giving mask to school boy predates COVID-19,FALSE
Fact-check: Did Sonia Gandhi sit on Manmohan Singh?s seat during Bangladesh visit?,https://www.altnews.in/fact-check-did-sonia-gandhi-sit-on-manmohan-singhs-seat-during-bangladesh-visit/,https://www.altnews.in/wp-content/uploads/2021/04/Untitled-design-2021-04-02T123933.388-300x157.jpg,Rohan Datta,2nd April 2021,Fact-check: Did Sonia Gandhi sit on Manmohan Singh?s seat during Bangladesh visit?,TRUE
Fact-check: Did SC overturn Allahabad HC?s order on reservation in UP panchayat polls?,https://www.altnews.in/fact-check-supreme-court-rejects-high-court-verdict-on-reservation/,https://www.altnews.in/wp-content/uploads/2021/04/FAKE-9-300x157.jpg,Kinjal,1st April 2021,Fact-check: Did SC overturn Allahabad HC?s order on reservation in UP panchayat polls?,TRUE
Did Indian Coast Guard intercept boats with narcotics and weapons headed to Kerala?,https://www.altnews.in/did-indian-coast-guard-intercept-boats-with-narcotics-and-weapons-headed-to-kerala/,https://www.altnews.in/wp-content/uploads/2021/03/Untitled-design-2021-06-28T161852.004-300x157.jpg,Archit,30th March 2021,Did Indian Coast Guard intercept boats with narcotics and weapons headed to Kerala?,TRUE
"Video of man shot dead is not from India, shared with false Naxal angle",https://www.altnews.in/video-of-man-shot-dead-is-not-from-india-shared-with-false-naxal-angle/,https://www.altnews.in/wp-content/uploads/2021/03/FI-2-7-300x157.jpg,Aqib Pathan,27th March 2021,"Video of man shot dead is not from India, shared with false Naxal angle",FALSE
"No, this photo doesn?t show last rites of Bhagat Singh, Sukhdev and Rajguru",https://www.altnews.in/no-this-image-does-not-show-cremation-of-martyrs-bhagat-singh-rajguru-sukhdev/,https://www.altnews.in/wp-content/uploads/2021/03/bhagat-singh-fi-300x157.jpeg,Anuradha Prasad,27th March 2021,"No, this photo doesn?t show last rites of Bhagat Singh, Sukhdev and Rajguru",FALSE
Old image of anti-France rally in Bangladesh viral as protests against PM Modi upcoming visit,https://www.altnews.in/image-of-an-anti-france-rally-in-bangladesh-shared-as-people-protesting-against-pm-modi/,https://www.altnews.in/wp-content/uploads/2021/03/modi-fi-300x157.jpeg,Anuradha Prasad,25th March 2021,Old image of anti-France rally in Bangladesh viral as protests against PM Modi upcoming visit,TRUE
Photos of BJP West Bengal workers clashing with each other is from 2016,https://www.altnews.in/2016-images-of-clash-in-bjp-party-workers-convention-in-howrah-west-bengal-shared-as-recent/,https://www.altnews.in/wp-content/uploads/2021/03/FAKE-1-5-300x157.jpeg,Kinjal,22nd March 2021,Photos of BJP West Bengal workers clashing with each other is from 2016,TRUE
Image of morphed cheque viral as Nirav Modi gave Rs 98 crore to Congress,https://www.altnews.in/fake-axis-bank-cheque-again-viral-claiming-diamond-merchant-and-fugitive-nirav-modi-paid-98-crores-to-congress-party/,https://www.altnews.in/wp-content/uploads/2021/03/nirav-fi-300x157.jpeg,Anuradha Prasad,18th March 2021,Image of morphed cheque viral as Nirav Modi gave Rs 98 crore to Congress,FALSE
Mirror image used to portray Mamata Banerjee faked her leg injury,https://www.altnews.in/false-claim-of-mamta-banarjee-leg-injury-shifted-from-left-to-right/,https://www.altnews.in/wp-content/uploads/2021/03/FI-1-5-300x157.jpg,Archit,17th March 2021,Mirror image used to portray Mamata Banerjee faked her leg injury,TRUE
Old image of Manohar Lal Khattar with former CM Bhupinder Hooda shared as recent,https://www.altnews.in/old-image-of-manohar-lal-khattar-with-former-cm-bhupendra-singh-hooda-viral-as-recent-collusion-of-bjp-and-congress/,https://www.altnews.in/wp-content/uploads/2021/03/bjp-cong-fi-300x157.jpeg,Anuradha Prasad,13th March 2021,Old image of Manohar Lal Khattar with former CM Bhupinder Hooda shared as recent,FALSE
Fake letter portrays PM Modi thanking Yogi Adityanath for his efforts in building Hindu nation,https://www.altnews.in/fake-letter-yogi-adityanath-pm-modi-hindu-rashtra/,https://www.altnews.in/wp-content/uploads/2021/03/FAKE-2-1-300x157.jpg,Kinjal,12th March 2021,Fake letter portrays PM Modi thanking Yogi Adityanath for his efforts in building Hindu nation,FALSE
Old hoax about scam in procurement of Indian Army boots revived,https://www.altnews.in/old-hoax-about-upa-involved-in-scam-related-to-procurement-of-army-boots-revived/,https://www.altnews.in/wp-content/uploads/2021/03/FI-4-300x157.jpg,Archit,11th March 2021,Old hoax about scam in procurement of Indian Army boots revived,FALSE
"Bhagat?s Singh sister passed away in 2014, not recently as claimed on social media",https://www.altnews.in/posts-claiming-demise-of-bhagat-singhs-sister-prakash-kaur-viral-again-she-died-in-2014/,https://www.altnews.in/wp-content/uploads/2021/03/prakash-kaur-fi-1-300x157.jpg,Anuradha Prasad,10th March 2021,"Bhagat?s Singh sister passed away in 2014, not recently as claimed on social media",FALSE
"Daral Uloom didn?t issue fatwa to lace food served to Hindus with chemicals, fake tweet viral",https://www.altnews.in/false-communal-message-in-the-name-of-fatwa-from-darul-uloom-madarsa-viral/,https://www.altnews.in/wp-content/uploads/2021/03/Gayor-FI-300x157.jpg,Anuradha Prasad,8th March 2021,"Daral Uloom didn?t issue fatwa to lace food served to Hindus with chemicals, fake tweet viral",TRUE
